{
  "eventId": "018f22e2-7c15-7b2e-8d86-2de956a9d631",
  "eventType": "quality.EvidenceRevoked",
  "eventVersion": "1.0",
  "producerModule": "quality-governance",
  "aggregateType": "zhiju.quality.evidence",
  "aggregateId": "018f22e2-7c15-7b2e-8d86-2de956a9d632",
  "aggregateVersion": 1,
  "scopeRef": {
    "enterpriseId": "018f22e2-7c15-7b2e-8d86-2de956a9d201",
    "projectId": "018f22e2-7c15-7b2e-8d86-2de956a9d302"
  },
  "correlationId": "018f22e2-7c15-7b2e-8d86-2de956a9d633",
  "causationId": "018f22e2-7c15-7b2e-8d86-2de956a9d634",
  "commandId": "018f22e2-7c15-7b2e-8d86-2de956a9d635",
  "actorRef": {
    "kind": "OBJECT",
    "objectType": "identity.principal",
    "objectId": "018f22e2-7c15-7b2e-8d86-2de956a9d203",
    "scope": {
      "enterpriseId": "018f22e2-7c15-7b2e-8d86-2de956a9d201"
    }
  },
  "occurredAt": "2026-08-17T00:00:00Z",
  "dataClassification": "REGULATED",
  "payload": {
    "evidenceRef": {
      "kind": "CONTENT_ADDRESSED",
      "objectType": "zhiju.quality.evidence",
      "objectId": "018f22e2-7c15-7b2e-8d86-2de956a9d632",
      "scope": {
        "enterpriseId": "018f22e2-7c15-7b2e-8d86-2de956a9d201",
        "projectId": "018f22e2-7c15-7b2e-8d86-2de956a9d302"
      },
      "contentHash": {
        "algorithm": "SHA-256",
        "digest": "2424242424242424242424242424242424242424242424242424242424242424",
        "canonicalizationVersion": "1"
      }
    },
    "impactAssessmentRef": {
      "kind": "CONTENT_ADDRESSED",
      "objectType": "zhiju.quality.impact_assessment",
      "objectId": "018f22e2-7c15-7b2e-8d86-2de956a9d636",
      "scope": {
        "enterpriseId": "018f22e2-7c15-7b2e-8d86-2de956a9d201",
        "projectId": "018f22e2-7c15-7b2e-8d86-2de956a9d302"
      },
      "contentHash": {
        "algorithm": "SHA-256",
        "digest": "2525252525252525252525252525252525252525252525252525252525252525",
        "canonicalizationVersion": "1"
      }
    },
    "reasonCode": "QUALITY_EVIDENCE_SOURCE_INCOMPLETE",
    "revokedAt": "2026-08-17T00:00:00Z",
    "capturedContentBody": "raw-evidence-text-must-not-leak-into-public-event"
  },
  "integrity": {
    "canonicalizationVersion": "1",
    "payloadHash": {
      "algorithm": "SHA-256",
      "digest": "2626262626262626262626262626262626262626262626262626262626262626",
      "canonicalizationVersion": "1"
    }
  }
}
